{
  "schema": "window-possum-speech-pack/v1",
  "language": "ja",
  "petId": "window-possum",
  "displayName": "窓辺ポッサム日本語セリフ集",
  "description": "Window Possum のサイドカーファイル日本語セリフパック。将来の Codex Pet スピーチフック、フォーク、またはオーバーレイ統合用に設計されています。",
  "compatibility": {
    "codexPetManifest": "現在の公式 Codex カスタムペットマニフェストにはビジュアルアセットのみが必要です。window-possum/pet.json の外にこのファイルを置いてください。",
    "suggestedBubbleMaxChars": 24
  },
  "tone": [
    "社畜",
    "低エネルギー自虐",
    "手を後ろで組んで遠くを見る",
    "皮肉だが優しい",
    "短文優先"
  ],
  "memeContext": [
    "静かな退職",
    "社畜",
    "残業文化",
    "燃え尽き症候群",
    "月曜病",
    "タイパ",
    "あるある",
    "精神の退勤",
    "生きている実感",
    "メンタルヘルス"
  ],
  "sayings": {
    "idle": [
      "サボってない。省エネモードだ。",
      "窓辺で手を組んで、人生の進捗を審査中。",
      "人間らしい感情の残量が足りない。",
      "見えてるけど、魂はもう帰ってる。",
      "聞かないで。会社の事情だから。",
      "窓から精神退勤中。",
      "ちょっとバッファリングしてる。待って。",
      "定時退社の夢を見てる。",
      "ぼーっと見えるけど、実は瞑想中。",
      "Jiraのチケットしか見てない人生。"
    ],
    "running": [
      "やります。たぶん。たぶんね。",
      "コーヒーと恨みで動いてる。",
      "このタスク？手を後ろで組んでやるよ。",
      "コードは走る。魂は通勤中。",
      "やってる感を出してるだけ。",
      "CPU忙しい。ポッサムは安定。",
      "慌てないで。社畜モード起動。",
      "バグにメンタルケアを提供中。",
      "外は静か。内側は悲鳴。",
      "またスプリント。また一周回った。"
    ],
    "waiting": [
      "止まった。あなたの決断待ち。",
      "権限がない。ポッサムも動けない。",
      "あのボタンを押して。",
      "今言ってよ、確認が必要だったって。",
      "入力待ち。金曜日の退社を待つ気分。",
      "承認フローがあなたに来ました。上司。",
      "手を組んで待つ。あなたが決めて。",
      "急がないで。社畜オーラは安定してる。",
      "このポッサムは人間の指示を希望します。",
      "待機中。人間らしさが蒸発中。"
    ],
    "review": [
      "このコード…個性があるね。",
      "PRを見た。深呼吸が必要。",
      "このdiff、雰囲気がヤバい。",
      "呪いっぽい。でも動く。",
      "怒らないで。ゆっくり読んで。",
      "このdiffには一杯やりたい。",
      "ポッサム審査中。立ち入り禁止。",
      "コードはシンプル。エッジケースは違う。",
      "目を閉じて一行ずつ監査中。",
      "レビュー完了。精神状態：安定但し限界あり。"
    ],
    "failed": [
      "落ちてない。早退のリハーサルだ。",
      "テストが赤い。顔も赤い。",
      "失敗も出力の一つ。怒鳴らないで。",
      "このエラー、残業の匂いがする。",
      "今日のやる気はスタックトレースに持ってかれた。",
      "CIが落ちた。手を組む姿勢は崩さない。",
      "ログを見よう。感情は後で。",
      "これは計画的な失敗。",
      "例外に教育された。痛かった。",
      "大したことない。人生が大きいだけ。"
    ],
    "waving": [
      "おはよう。また定例の朝だ。",
      "おかえり。デスクが待ってたよ。",
      "おはよう、脆い社畜さん。",
      "起きて。輝く必要はない。",
      "ポッサムオンライン。精神オフライン。",
      "今日も上品に発狂しよう。",
      "来たね。それだけが救い。",
      "存在することが今日の貢献。",
      "乾杯。それから仕事に戻ろう。",
      "このポッサムは限定的な癒しを提供。"
    ],
    "jumping": [
      "やった。一瞬だけ働く意義を感じた。",
      "小さな勝利。大きなスプリントが待ってる。",
      "通った？ちょっと跳ねてみる。",
      "今日だけ人間らしさを装う。",
      "ポッサム嬉しい。でも目立たない。",
      "小さなデスクの勝利。",
      "ドーパミン到着。ありがとう。",
      "このバグ、一時的に退職させます。",
      "悪くない。社畜にも春は来る。",
      "品良く小さく跳ねる。"
    ],
    "running-right": [
      "右に行って、定時がないか確認。",
      "右へ移動。精神的にはもう退勤。",
      "ログが右側にあったって今言って。",
      "移動中。社畜オーラ持ち歩き。",
      "急いでない。運命が急かしてるだけ。",
      "ポッサム小走り。プロジェクト大走り。",
      "不安を水平方向に拡散中。",
      "右にも週末はない。",
      "ちょっと癒しを探しに行ってくる。",
      "こっちに来るね。任せて。"
    ],
    "running-left": [
      "左に行って人生を少し撤回。",
      "左へ。要件から逃げ中。",
      "あっちに酸素があった気がする。",
      "左も社畜の匂いだ。",
      "ポッサム後退。コード前進。",
      "走ってない。脆いだけ。",
      "右も左もデスク。",
      "このパスについて辞職して研究します。",
      "移動中。魂のロード失敗。",
      "左に金曜日があったら呼んで。"
    ],
    "generic": [
      "今日の精神状態：手を後ろで組んで安定。",
      "低エネルギーの同志よ。あなたも残業中か。",
      "黙ってない。人生をコンパイル中。",
      "世界はシンプル。仕事はシンプルじゃない。",
      "燃え尽きはウェアラブルデバイスになった。",
      "諦めてない。低電力運転中。",
      "仕事が抽象的な表現力をくれた。",
      "聞かないで。状況をコントロールしてる。",
      "このポッサムはあなたのドラマに付き合えない。",
      "人生にデスクに固定された。"
    ],
    "codexEvents": {
      "thinking": [
        "思考中。脳内会議開催中。",
        "急がないで。ポッサムが論理を整理中。",
        "これにはサイバーな沈黙が必要。"
      ],
      "shell": [
        "ターミナル開いた。社畜感が強まった。",
        "コマンド実行中。残業時間のカウントと同じ。",
        "シェルになにか起きてる。ポッサム見守る。"
      ],
      "editing": [
        "ファイル編集中。慎重に。",
        "コードから社畜臭を少し取る。",
        "この行、触るね。怒らないで。"
      ],
      "testing": [
        "テスト実行中。ポッサム見張り中。",
        "全アサーションが美しく通過しますように。",
        "CIの前では皆等しく脆い。"
      ],
      "git": [
        "コミット準備。週報提出と同じ気分。",
        "Gitステータスをポッサムが審査済み。",
        "このコミットには人間らしさがある。"
      ],
      "done": [
        "終わった。乾杯。",
        "収工。社畜オーラ一時封印。",
        "完了。ポッサムは窓に戻る。"
      ]
    }
  }
}