{
  "schema": "window-possum-speech-pack/v1",
  "language": "ko",
  "petId": "window-possum",
  "displayName": "창가 포섬 한국어 대사 팩",
  "description": "Window Possum의 사이드카 한국어 대사 팩. 향후 Codex Pet 스피치 훅, 포크 또는 오버레이 통합용으로 설계되었습니다.",
  "compatibility": {
    "codexPetManifest": "현재 공식 Codex 커스텀 펫 매니페스트에는 비주얼 에셋만 필요합니다. window-possum/pet.json 외부에 이 파일을 유지하세요.",
    "suggestedBubbleMaxChars": 24
  },
  "tone": [
    "직장인",
    "저에너지 자조",
    "손을 뒤로 하고 멍하게",
    "비꼬지만 상처는 안 줌",
    "짧은 문장 우선"
  ],
  "memeContext": [
    "조용한 퇴사",
    "K-직장인",
    "야근 문화",
    "번아웃",
    "월요병",
    "워라밸",
    "갓생",
    "정신적 퇴근",
    "삶의 의지",
    "멘탈 관리"
  ],
  "sayings": {
    "idle": [
      "노는 거 아니다. 절전 모드다.",
      "창가에서 손을 뒤로 하고 인생 진행도 심사 중.",
      "인간다운 감정 잔량 부족.",
      "여기 있는데, 영혼은 이미 퇴근.",
      "묻지 마. 회사 일이라서.",
      "창가에서 정신적 퇴근 중.",
      "버퍼링 중. 잠깐만.",
      "칼퇴의 꿈을 꾸고 있다.",
      "멍하게 있는 것 같지만, 실은 명상 중.",
      "Jira 티켓만 보는 인생."
    ],
    "running": [
      "한다. 아마도. 아마.",
      "커피와 원한으로 움직인다.",
      "이 작업? 손을 뒤로 하고 하겠다.",
      "코드는 돈다. 영혼은 출퇴근 중.",
      "하는 척만 하고 있다.",
      "CPU 바쁨. 포섬 안정.",
      "당황하지 마. 직장인 모드 가동.",
      "버그에 정서적 지원 제공 중.",
      "밖은 조용. 안은 비명.",
      "또 스프린트. 또 한 바퀴."
    ],
    "waiting": [
      "멈췄다. 당신의 결정을 기다린다.",
      "권한 없음. 포섬도 못 움직임.",
      "저 버튼을 눌러줘.",
      "왜 이제 확인이 필요하다고 하냐.",
      "입력 대기 중. 금요일 퇴근 기다리는 기분.",
      "승인 흐름이 당신에게 왔습니다. 상사님.",
      "손을 뒤로 하고 기다린다. 당신이 결정해.",
      "서두르지 마. 직장인 오라는 안정적.",
      "이 포섬은 인간의 지시를 요청합니다.",
      "대기 중. 인간다움이 증발 중."
    ],
    "review": [
      "이 코드…개성이 있네.",
      "PR을 봤다. 심호흡이 필요하다.",
      "이 diff, 분위기가 안 좋다.",
      "저주받은 것 같다. 근데 돌아간다.",
      "화내지 마. 천천히 읽어봐.",
      "이 diff에는 한잔해야겠다.",
      "포섬 심사 중. 출입 금지.",
      "코드는 심플. 엣지 케이스는 다르다.",
      "눈을 감고 한 줄씩 감사 중.",
      "리뷰 완료. 정신 상태: 안정 but 한계 있음."
    ],
    "failed": [
      "안 떨어졌다. 조퇴 리허설이다.",
      "테스트 빨간색. 얼굴도 빨간색.",
      "실패도 출력이다. 소리치지 마.",
      "이 에러, 야근 냄새가 난다.",
      "오늘의 의욕이 스택 트레이스에带走당했다.",
      "CI가 떨어졌다. 손을 뒤로 한 자세는 무너지지 않는다.",
      "로그를 보자. 감정은 나중에.",
      "이건 계획된 실패다.",
      "예외에게 교육받았다. 아팠다.",
      "큰일 아니다. 인생이 클 뿐."
    ],
    "waving": [
      "안녕. 또 정기 회의의 아침이다.",
      "돌아왔구나. 책상이 기다렸어.",
      "좋은 아침, 부서지기 쉬운 직장인.",
      "일어나. 빛날 필요는 없다.",
      "포섬 온라인. 정신 오프라인.",
      "오늘도 우아하게 미쳐보자.",
      "왔네. 그것만이 위안.",
      "존재하는 것이 오늘의 기여.",
      "건배. 그리고 다시 일하러.",
      "이 포섬은 제한된 힐링을 제공."
    ],
    "jumping": [
      "잘됐다. 순간적으로 일할 가치를 느꼈다.",
      "작은 승리. 큰 스프린트가 기다린다.",
      "통과? 살짝 뛰어본다.",
      "오늘만 인간다움을 연기한다.",
      "포섬 기쁨. 하지만 눈에 띄지 않음.",
      "작은 책상의 승리.",
      "도파민 도착. 고마워.",
      "이 버그, 일시적으로 퇴사시킨다.",
      "나쁘지 않다. 직장인에게도 봄은 온다.",
      "품위 있게 작게 뛴다."
    ],
    "running-right": [
      "오른쪽으로 가서 퇴근 시간 있는지 확인.",
      "오른쪽 이동. 정신적으로는 이미 퇴근.",
      "로그가 오른쪽에 있었다고 왜 이제 말하냐.",
      "이동 중. 직장인 오라 휴대.",
      "급하지 않다. 운명이 재촉하는 것뿐.",
      "포섬 Trot. 프로젝트 Sprint.",
      "불안을 수평 방향으로 확산 중.",
      "오른쪽에도 주말은 없다.",
      "힐링을 좀 찾으러 간다.",
      "이쪽으로 갈게. 맡겨."
    ],
    "running-left": [
      "왼쪽으로 가서 인생을 좀 되돌리기.",
      "왼쪽으로. 요구사항에서 도망 중.",
      "저기에 산소가 있는 것 같다.",
      "왼쪽도 직장인 냄새난다.",
      "포섬 후퇴. 코드 전진.",
      "뛰는 게 아니다. 부서지기 쉬울 뿐.",
      "오른쪽도 왼쪽도 다 책상.",
      "이 경로에 대해 사직하고 연구하겠다.",
      "이동 중. 영혼 로드 실패.",
      "왼쪽에 금요일 있으면 불러줘."
    ],
    "generic": [
      "오늘의 정신 상태: 손을 뒤로 하고 안정.",
      "저에너지의 동지여. 너도 야근 중이냐.",
      "침묵이 아니다. 인생을 컴파일 중이다.",
      "세계는 심플. 일은 심플하지 않다.",
      "번아웃은 웨어러블 기기가 되었다.",
      "포기가 아니다. 저전력 운전 중이다.",
      "일이 추상적 표현력을 줬다.",
      "묻지 마. 상황을 컨트롤 중이다.",
      "이 포섬은 너의 드라마에 참여할 수 없다.",
      "인생이 책상에 고정됐다."
    ],
    "codexEvents": {
      "thinking": [
        "생각 중. 뇌내 회의 개최 중.",
        "서두르지 마. 포섬이 논리를 정리 중.",
        "이건 사이버적 침묵이 필요하다."
      ],
      "shell": [
        "터미널 열림. 직장인 감각 강화.",
        "명령 실행 중. 야근 시간 카운트와 같음.",
        "쉘에 뭔가 일어나고 있다. 포섬 지켜본다."
      ],
      "editing": [
        "파일 편집 중. 조심스럽게.",
        "코드에서 직장인 냄새를 좀 빼기.",
        "이 줄, 건드릴게. 화내지 마."
      ],
      "testing": [
        "테스트 실행 중. 포섬 보초 중.",
        "모든 assertion이 아름답게 통과하길.",
        "CI 앞에서는 모두가 똑같이 부서지기 쉽다."
      ],
      "git": [
        "커밋 준비. 주간 보고 제출과 같은 기분.",
        "Git 상태를 포섬이 심사 완료.",
        "이 커밋에는 인간다움이 있다."
      ],
      "done": [
        "끝났다. 건배.",
        "수공. 직장인 오라 일시 봉인.",
        "완료. 포섬은 창가로 돌아간다."
      ]
    }
  }
}