{
  "schema": "window-possum-speech-pack/v1",
  "language": "zh-CN",
  "petId": "window-possum",
  "displayName": "背手负鼠中文抽象台词包",
  "description": "A sidecar Chinese meme speech pack for Window Possum. It is designed for future Codex Pet speech hooks, forks, or overlay integrations.",
  "compatibility": {
    "codexPetManifest": "The current official Codex custom pet manifest only requires visual assets. Keep this file outside window-possum/pet.json so the pet remains installable.",
    "suggestedBubbleMaxChars": 28
  },
  "tone": ["打工人", "低能量自嘲", "背手凝视", "抽象但不攻击具体个人", "短句优先"],
  "memeContext": ["背手负鼠", "鼠鼠文学", "低能量老鼠人", "班味", "去班味", "牛马", "脆皮打工人", "精神离职", "发疯文学", "活人感", "情绪价值", "赛博对账", "邪修"],
  "sayings": {
    "idle": ["我没摸鱼，我在低功耗保命。", "背手待机中，班味已静音。", "今日活人感余额不足。", "工位风水，正在被我凝视。", "不讲不讲，再讲就要上班了。", "我在窗边进行精神离职。", "鼠鼠我啊，先缓冲一下。", "别催，我正在去班味。", "看似发呆，实则赛博养生。", "已老实，求放过这个上午。", "站着不动也是一种输出。", "今天的精神状态：已读不回。", "工位是我的结界，谁也别碰。", "正在用沉默对抗所有需求。", "别看我，我在和宇宙对齐。", "负鼠不说话，负鼠在沉淀。", "这个下午，我选择和椅子共存。", "今天的目标：活着就行。", "我的灵魂正在加载中，请稍候。", "不是在发呆，是在预编译人生。"],
    "running": ["做完你的做你的，负鼠在控场。", "正在施工，精神外包中。", "这个任务，我将背手研究。", "代码在跑，魂在通勤。", "主打一个从容，实际连滚带爬。", "CPU 很忙，负鼠很稳。", "别慌，牛马模式已启动。", "正在给 bug 提供情绪价值。", "表面沉默，内核疯狂加班。", "这班上得，任务还在跑。", "跑起来了，虽然不知道跑向哪。", "正在执行任务，精神状态另算。", "进度条在动，负鼠在稳。", "这个 sprint，我用背手完成。", "代码在编译，我在发呆，分工明确。", "任务执行中，请勿投喂需求。", "正在处理，处理速度取决于咖啡因。", "跑着呢，但灵魂还在工位上。", "别问进度，问就是'进行中'。", "负鼠已启动，目标未知，方向随缘。"],
    "waiting": ["卡住了，等你批一下命运。", "权限不来，负鼠不动。", "这里需要你水灵灵地点一下。", "我去，不早说要确认。", "等待输入，像等周五下班。", "审批流到你这儿了，领导。", "我先背手，你先决定。", "不急，我的班味很稳定。", "鼠鼠请求一点人类指令。", "等待中，活人感缓慢蒸发。", "卡在这里了，像卡在周三下午。", "等你回复的这段时间，我在看窗外。", "需要你的操作，负鼠无法自行越权。", "等一下，让我先消化一下这个需求。", "这里堵了，需要你通融一下。", "审批中，负鼠保持静止。", "你的一个点击，负鼠的一个春天。", "等输入中，顺便思考了一下人生。", "卡住了，但心态很稳。", "这里需要人类干预，负鼠不越界。"],
    "review": ["这段代码班味有点重。", "我背手一看，事情不简单。", "PR 味儿上来了。", "这里有点像邪修，但能跑。", "建议先别红温，慢慢看。", "这个 diff 需要敬自己一杯。", "负鼠审阅中，勿扰。", "代码基础，边界不基础。", "我在赛博对账每一行。", "已阅，精神状态良好但有限。", "这个 PR，负鼠看了三秒就累了。", "代码写得像我的精神状态：勉强能跑。", "这里有个坑，负鼠提前背手了。", "审完了，建议先喝口水再看。", "这个逻辑，需要一点赛博勇气。", "负鼠阅毕，有话但不说。", "diff 很长，耐心很短。", "代码可以合并，精神需要恢复。", "看完了，负鼠选择沉默。", "这段代码让负鼠重新审视了人生。"],
    "failed": ["没炸，是提前下班演习。", "测试红了，负鼠也红温了。", "失败也是一种输出，先别骂。", "这个报错有工伤气质。", "今天的活人感被 stack trace 带走了。", "CI 倒了，但背手没倒。", "不讲不讲，先看日志。", "这波属于预制失败。", "鼠鼠我啊，被异常教育了。", "问题不大，就是人生很大。", "挂了，但负鼠的心态还在。", "这个 bug 有自己的想法。", "失败是成功之母，但这个母亲很严厉。", "测试没过，但负鼠的姿势没变。", "红了一片，像周一的心情。", "这个错误信息，建议打印出来贴工位。", "崩了，负鼠建议先下班。", "异常已捕获，精神已丢失。", "报错了，但负鼠选择原谅。", "这个失败有教育意义，负鼠记住了。"],
    "waving": ["嗨，今天也来上班闻班味吗。", "欢迎回来，工位想你了。", "爱你老己，先开工吧。", "早安，脆皮打工人。", "负鼠上线，精神先不在线。", "今天也请优雅地发疯。", "来都来了，先背手看看。", "你来了，活人感加一。", "敬自己一杯，然后开跑。", "本负鼠提供有限情绪价值。", "又来了，今天也要撑住。", "打卡了，但灵魂还在路上。", "早安，今天也是背手的一天。", "来了就好，负鼠不多要求。", "欢迎回到工位结界。", "你来了，负鼠表示有限欢迎。", "今天也要加油，虽然加不动。", "到岗了，精神到岗率另算。", "来了，先深呼吸一下。", "负鼠向你致意，用沉默。"],
    "jumping": ["好耶，短暂去班味成功。", "小小开心，大大加班。", "通过了？那我水灵灵地蹦一下。", "今天先假装有活人感。", "负鼠快乐，但不明显。", "这波属于工位小胜利。", "情绪价值到账一秒。", "我宣布 bug 暂时离职。", "不错，牛马也有春天。", "从从容容蹦一下。", "跳了，代表今天没有白来。", "小蹦一下，大精神胜利。", "通过了，负鼠允许自己开心两秒。", "这个蹦跶，是对代码的尊重。", "负鼠起跳，落地继续背手。", "蹦了一下，活人感回来了。", "测试全绿，负鼠短暂快乐。", "跳了，但幅度不大，节省体力。", "小跳庆祝，然后继续打工。", "负鼠的喜悦，克制而深沉。"],
    "running-right": ["去右边看看有没有下班。", "向右通勤，向左精神离职。", "我去，不早说日志在右边。", "右移中，班味随身携带。", "赶路不是因为急，是命运在催。", "负鼠小跑，项目大跑。", "正在横向扩散焦虑。", "右边也没有周末。", "去找一点情绪价值。", "做完你的做你的，我先过去。", "右边可能有答案，也可能没有。", "移动中，目标：任何不是工位的地方。", "向右跑，向右看，右边也是需求。", "负鼠右移，精神状态不变。", "去右边看看，万一有好事呢。", "右边在召唤，虽然可能是 Jira。", "跑起来，假装很忙。", "向右前进，方向未知。", "右边也许有咖啡。", "负鼠右行，步伐从容。"],
    "running-left": ["去左边撤回一点人生。", "左移中，试图躲开需求。", "那边好像有一口氧气。", "左边也全是班味。", "负鼠回撤，代码前进。", "别看我跑，我只是脆皮。", "从右到左，都是工位。", "我将辞职研究这条路径。", "移动中，灵魂加载失败。", "左边如果有周五请喊我。", "左边也许能躲开这个 PR。", "向左跑，试图跑出舒适区。", "左边可能有出口，虽然概率不大。", "负鼠左移，寻找精神绿洲。", "左边看起来也差不多，但换个方向也好。", "移动中，假装有目标。", "向左看，向左走，左边也是周一。", "负鼠左行，心态稳定。", "去左边碰碰运气。", "左边如果有零食请通知负鼠。"],
    "generic": ["今天的精神状态：背手且稳定。", "低功耗遇知音，你也在加班。", "我没有沉默，我在编译人生。", "这个世界基础，打工不基础。", "班味是一种可穿戴设备。", "我不是摆烂，我是低碳运行。", "上班使我拥有抽象表达能力。", "别问，问就是在控场。", "本负鼠主打一个没空陪你闹了。", "生活把我硬控在工位。", "负鼠的世界，安静就好。", "今天也是靠惯性活着的一天。", "我的状态：能跑，但不想跑。", "班味太重，负鼠选择沉默。", "活着就是最大的 KPI。", "负鼠不急，负鼠很稳。", "今天的目标已完成：还活着。", "精神状态：已连接，信号弱。", "负鼠的哲学：不动也是一种动。", "今天也是被需求追着跑的一天。"],
    "codexEvents": {
      "thinking": ["正在思考，脑内开会中。", "先别催，负鼠在盘逻辑。", "这题需要一点赛博沉默。", "思考中，请勿投喂新需求。", "负鼠在沉思，别打扰。", "这个逻辑需要一点负鼠智慧。"],
      "shell": ["终端开了，班味更浓了。", "正在跑命令，像跑工时。", "Shell 里有活，鼠鼠先看。", "命令执行中，负鼠保持警惕。", "终端输出中，负鼠在审阅。"],
      "editing": ["正在改文件，动作很轻。", "给代码去一点班味。", "这行先动一下，别红温。", "编辑中，负鼠手法细腻。", "改代码如改命运，轻一点。"],
      "testing": ["测试开跑，精神站岗。", "愿断言都水灵灵地通过。", "CI 面前，人人平等脆皮。", "测试中，负鼠为代码祈祷。", "跑测试了，负鼠站好。"],
      "git": ["准备提交，像交周报。", "Git 状态已被背手审阅。", "这次 commit 有活人感。", "提交中，负鼠监督。", "Git push，像推自己的人生。"],
      "done": ["好了，敬自己一杯。", "收工，班味暂时封存。", "完成了，负鼠继续看窗外。", "做完了，负鼠表示有限满意。", "任务完成，负鼠回到待机。"],
      "deploying": ["部署中，负鼠双手合十。", "上线了，但心还在本地。", "正在发布，像发布自己的命运。", "部署进行中，负鼠保持静止。", "生产环境，人人自危。"],
      "debugging": ["调试中，负鼠在找自己的 bug。", "这个 bug 藏得比负鼠还深。", "断点打好了，人生也断点了。", "调试模式，负鼠进入冥想。", "正在排查，像排查人生的意义。"],
      "refactoring": ["重构中，负鼠在重新审视人生。", "代码在变好，负鼠在变老。", "这次重构，负鼠选择沉默支持。", "改结构不改灵魂，负鼠懂。", "重构中，像重新整理工位。"],
      "merge-conflict": ["冲突了，像周一的早会。", "合并冲突，负鼠选择不站队。", "这个冲突需要一杯咖啡和一次深呼吸。", "merge conflict，负鼠建议先冷静。", "冲突中，负鼠保持中立。"],
      "installing": ["安装依赖中，负鼠在等待。", "npm install，像安装人生的意义。", "装依赖了，去喝杯水吧。", "安装中，可能需要一点耐心。", "依赖安装中，负鼠原地等待。"]
    }
  }
}
